{"$schema":"https://json-schema.org/draft/2020-12/schema","$id":"https://github.com/rafaelmeloreisnovo/Vectras-VM-Android/schemas/guest_boot_evidence.v1.schema.json","title":"Vectras Guest Boot Evidence v1","description":"Structural VM lifecycle evidence. Validation does not prove a boot unless every prerequisite gate and hash is present.","type":"object","additionalProperties":false,"required":["schema","claim_allowed","observed_at","runtime","gates","safety","decision"],"properties":{"schema":{"const":"vectras.guest_boot_evidence.v1"},"claim_allowed":{"const":false},"observed_at":{"type":"string","minLength":1},"runtime":{"type":"object","additionalProperties":false,"required":["apk_sha256","device_abi","qemu_binary_sha256","image_sha256","launch_command","guest_marker","console_log_sha256"],"properties":{"apk_sha256":{"type":"string"},"device_abi":{"type":"string"},"qemu_binary_sha256":{"type":"string"},"image_sha256":{"type":"string"},"launch_command":{"type":"string"},"guest_marker":{"type":"string"},"console_log_sha256":{"type":"string"}}},"gates":{"type":"object","additionalProperties":false,"required":["app_build","shell","storage","proot","qemu","image","command","process","guest_boot"],"properties":{"app_build":{"enum":["PASS","TOKEN_VAZIO","BLOCKED","FAIL"]},"shell":{"enum":["PASS","TOKEN_VAZIO","BLOCKED","FAIL"]},"storage":{"enum":["PASS","TOKEN_VAZIO","BLOCKED","FAIL"]},"proot":{"enum":["PASS","TOKEN_VAZIO","BLOCKED","FAIL"]},"qemu":{"enum":["PASS","TOKEN_VAZIO","BLOCKED","FAIL"]},"image":{"enum":["PASS","TOKEN_VAZIO","BLOCKED","FAIL"]},"command":{"enum":["PASS","TOKEN_VAZIO","BLOCKED","FAIL"]},"process":{"enum":["PASS","TOKEN_VAZIO","BLOCKED","FAIL"]},"guest_boot":{"enum":["PASS","TOKEN_VAZIO","BLOCKED","FAIL"]}}},"safety":{"type":"object","additionalProperties":false,"required":["disk_mutated","safe_state","rollback"],"properties":{"disk_mutated":{"type":"boolean"},"safe_state":{"const":"vm-stopped-no-image-mutation"},"rollback":{"type":"string","minLength":5}}},"decision":{"type":"object","additionalProperties":false,"required":["status","next_action"],"properties":{"status":{"enum":["VERIFIED_LIMITED","TOKEN_VAZIO","BLOCKED","CONTRADICTION"]},"next_action":{"type":"string","minLength":10}}}}}
