{"schema":"vectras.guest_boot_evidence.v1","claim_allowed":false,"observed_at":"2026-07-17T00:00:00Z","runtime":{"apk_sha256":"TOKEN_VAZIO","device_abi":"TOKEN_VAZIO","qemu_binary_sha256":"TOKEN_VAZIO","image_sha256":"TOKEN_VAZIO","launch_command":"TOKEN_VAZIO","guest_marker":"TOKEN_VAZIO","console_log_sha256":"TOKEN_VAZIO"},"gates":{"app_build":"TOKEN_VAZIO","shell":"TOKEN_VAZIO","storage":"TOKEN_VAZIO","proot":"TOKEN_VAZIO","qemu":"TOKEN_VAZIO","image":"TOKEN_VAZIO","command":"TOKEN_VAZIO","process":"TOKEN_VAZIO","guest_boot":"BLOCKED"},"safety":{"disk_mutated":false,"safe_state":"vm-stopped-no-image-mutation","rollback":"Retain base commit, APK/image hashes and stop the VM before mutation."},"decision":{"status":"BLOCKED","next_action":"Run the canonical build and device/QEMU smoke path, then attach console marker and hashes."}}
